id,question,A,B,C,D,E,F,G,answer
188,"A user on your Windows 2000 network has discovered that he can use L0phtcrack to sniff the SMB exchanges which carry user logons. The user is plugged into a hub with 23 other systems. However, he is unable to capture any logons though he knows that other users are logging in. What do you think is the most likely reason behind this?","There is a NIDS present on that segment.","Kerberos is preventing it.","Windows logons cannot be sniffed.","L0phtcrack only sniffs logons to web servers.","","","","B"
189,"Yancey is a network security administrator for a large electric company. This company provides power for over 100, 000 people in Las Vegas. Yancey has worked for his company for over 15 years and has become very successful. One day, Yancey comes in to work and finds out that the company will be downsizing and he will be out of a job in two weeks. Yancey is very angry and decides to place logic bombs, viruses, Trojans, and backdoors all over the network to take down the company once he has left. Yancey does not care if his actions land him in jail for 30 or more years, he just wants the company to pay for what they are doing to him. What would Yancey be considered?","Yancey would be considered a Suicide Hacker","Since he does not care about going to jail, he would be considered a Black Hat","Because Yancey works for the company currently; he would be a White Hat","Yancey is a Hacktivist Hacker since he is standing up to a company that is downsizing","","","","A"
190,"Which of the following steps for risk assessment methodology refers to vulnerability identification?","Determines if any flaws exist in systems, policies, or procedures","Assigns values to risk probabilities; Impact values.","Determines risk probability that vulnerability will be exploited (Hig","Medium, Low)","Identifies sources of harm to an IT syste","(Natural, Huma","Environmental)","C"
191,"The tools which receive event logs from servers, network equipment, and applications, and perform analysis and correlation on those logs, and can generate alarms for security relevant issues, are known as what?","network Sniffer","Vulnerability Scanner","Intrusion prevention Server","Security incident and event Monitoring","","","","D"
192,"What is the following command used for? net use \targetipc$ """" /u:""""","Grabbing the etc/passwd file","Grabbing the SAM","Connecting to a Linux computer through Samba.","This command is used to connect as a null session","Enumeration of Cisco routers","","","D"
193,"John the Ripper is a technical assessment tool used to test the weakness of which of the following?","Passwords","File permissions","Firewall rulesets","Usernames","","","","A"
194,"During a black-box pen test you attempt to pass IRC traffic over port 80/TCP from a compromised web enabled host. The traffic gets blocked; however, outbound HTTP traffic is unimpeded. What type of firewall is inspecting outbound traffic?","Circuit","Stateful","Application","Packet Filtering","","","","B"
195,"What term describes the amount of risk that remains after the vulnerabilities are classified and the countermeasures have been deployed?","Residual risk","Impact risk","Deferred risk","Inherent risk","","","","A"
196,"Why is a penetration test considered to be more thorough than vulnerability scan?","Vulnerability scans only do host discovery and port scanning by default.","A penetration test actively exploits vulnerabilities in the targeted infrastructure, while a vulnerability scan does not typically involve active exploitation.","It is not – a penetration test is often performed by an automated tool, while a vulnerability scan requires active engagement.","The tools used by penetration testers tend to have much more comprehensive vulnerability databases.","","","","B"
